{"baseline_policy_sha256":"57e4b6ca0f628f1145b982550166e55300fd850448372668955d017d2dcd36c8","candidate_policy_sha256":"a81c8687a278c8afd0195c247c227b28abdf56c88488cb6d928fa5414e916dad","changes":[{"baseline_names":["order_id"],"candidate_names":["order_id"],"compatibility":"ACCEPT","impact":"none","kind":"unchanged","logical_ids":["order-id"],"reason":"FIELD_IDENTITY_PRESERVED"},{"baseline_names":["gross_amount"],"candidate_names":["order_total"],"compatibility":"ACCEPT","impact":"input-only","kind":"renamed","logical_ids":["gross-amount"],"reason":"FIELD_IDENTITY_PRESERVED"},{"candidate_names":["migration_batch"],"compatibility":"ACCEPT","impact":"input-only","kind":"added","logical_ids":["migration-batch"],"reason":"EXCLUDED_STRUCTURAL_FIELD"}],"compatibility":"ACCEPT","direction":"baseline-to-candidate","evolution_sha256":"3c22abf3e84962fb05d4c3d76290c4c4299b5fb2ed494082f1de31921d46efe9","policy_diff_sha256":"d15d1881735f3e6f3453384388d00dd80e105d84b0c47d08e6a9752f5c5e6fa5","policy_diff_version":1}
